{
  "formatVersion": 1,
  "roots": [
    "docs/guards/V3_ifx/ci/",
    "docs/guards/V3_ifx/policy/",
    "docs/guards/V3_ifx/profiles/ifx/",
    "docs/guards/V3_ifx/shared/",
    "docs/guards/V3_ifx/stages/"
  ],
  "excluded": [
    "docs/guards/V3_ifx/stages/diff/authorizations/",
    "docs/guards/V3_ifx/stages/analysis/evidence/refactor-baseline/"
  ],
  "entries": [
    {
      "id": "ifx-profile-layout",
      "role": "trust-meta-policy",
      "paths": [
        "docs/guards/V3_ifx/shared/profile-layout.json"
      ],
      "format": "json",
      "schema": "docs/guards/V3/contracts/profile-layout.schema.json",
      "candidateValidation": "v3-profile"
    },
    {
      "id": "ifx-profile",
      "role": "editable-policy",
      "paths": [
        "docs/guards/V3_ifx/shared/profile.json"
      ],
      "format": "json",
      "schema": "docs/guards/V3/contracts/profile.schema.json",
      "candidateValidation": "v3-profile"
    },
    {
      "id": "ifx-project-map",
      "role": "editable-policy",
      "paths": [
        "docs/guards/V3_ifx/stages/pre/project-map.json"
      ],
      "format": "json",
      "schema": "docs/guards/V3/contracts/project-map.schema.json",
      "candidateValidation": "v3-profile"
    },
    {
      "id": "ifx-tech-stack",
      "role": "editable-policy",
      "paths": [
        "docs/guards/V3_ifx/shared/toolchain.json"
      ],
      "format": "json",
      "schema": "docs/guards/V3/contracts/tech-stack.schema.json",
      "candidateValidation": "v3-profile"
    },
    {
      "id": "ifx-rules",
      "role": "editable-policy",
      "directory": "docs/guards/V3_ifx/stages/post/rules/",
      "format": "json",
      "schema": "docs/guards/V3/contracts/rule.schema.json",
      "candidateValidation": "v3-profile"
    },
    {
      "id": "layerguard-policy",
      "role": "editable-policy",
      "paths": [
        "docs/guards/V3_ifx/stages/post/policy/layerguard.json"
      ],
      "format": "json",
      "candidateValidation": "json"
    },
    {
      "id": "plan05-baseline",
      "role": "editable-policy",
      "paths": [
        "docs/guards/V3_ifx/stages/post/policy/baselines/plan05.json"
      ],
      "format": "json",
      "candidateValidation": "json"
    },
    {
      "id": "history-manifest",
      "role": "editable-policy",
      "paths": [
        "docs/guards/V3_ifx/stages/post/gates/historical-integrity/manifest.json"
      ],
      "format": "json",
      "candidateValidation": "history-manifest"
    },
    {
      "id": "authority-registry",
      "role": "trust-meta-policy",
      "paths": [
        "docs/guards/V3_ifx/shared/authorities/authorities.json"
      ],
      "format": "json",
      "schema": "docs/guards/V3_ifx/shared/contracts/authorities.schema.json",
      "candidateValidation": "json-schema"
    },
    {
      "id": "stage-manifests",
      "role": "trust-meta-policy",
      "paths": [
        "docs/guards/V3_ifx/stages/analysis/stage.json",
        "docs/guards/V3_ifx/stages/bootstrap/stage.json",
        "docs/guards/V3_ifx/stages/ci/stage.json",
        "docs/guards/V3_ifx/stages/diff/stage.json",
        "docs/guards/V3_ifx/stages/post/stage.json",
        "docs/guards/V3_ifx/stages/pre/stage.json"
      ],
      "format": "json",
      "schema": "docs/guards/V3_ifx/shared/contracts/stage.schema.json",
      "candidateValidation": "json-schema"
    },
    {
      "id": "diff-protection",
      "role": "trust-meta-policy",
      "paths": [
        "docs/guards/V3_ifx/stages/diff/protection.json"
      ],
      "format": "json",
      "schema": "docs/guards/V3_ifx/stages/diff/contracts/protection.schema.json",
      "candidateValidation": "json-schema"
    },
    {
      "id": "analysis-evidence",
      "role": "trust-meta-policy",
      "paths": [
        "docs/guards/V3_ifx/stages/analysis/evidence/legacy-deletion-manifest.json",
        "docs/guards/V3_ifx/stages/analysis/evidence/p11-compatibility-deletion-manifest.json",
        "docs/guards/V3_ifx/stages/analysis/reports/cutover-baseline.json",
        "docs/guards/V3_ifx/stages/analysis/reports/specialized-parity.json",
        "docs/guards/V3_ifx/stages/analysis/reports/refactor-progress/cp02-ci-contract-remote.json"
      ],
      "format": "json",
      "candidateValidation": "json"
    },
    {
      "id": "docs-map",
      "role": "trust-meta-policy",
      "paths": [
        "docs/guards/V3_ifx/docs/docs-map.json"
      ],
      "format": "json",
      "schema": "docs/guards/V3_ifx/shared/contracts/docs-map.schema.json",
      "candidateValidation": "json-schema"
    },
    {
      "id": "command-manifest",
      "role": "trust-meta-policy",
      "paths": [
        "docs/guards/V3_ifx/shared/commands.json"
      ],
      "format": "json",
      "schema": "docs/guards/V3_ifx/shared/contracts/commands.schema.json",
      "candidateValidation": "json-schema"
    },
    {
      "id": "trusted-component-manifest",
      "role": "trust-meta-policy",
      "paths": [
        "docs/guards/V3_ifx/shared/trusted-components.json"
      ],
      "format": "json",
      "schema": "docs/guards/V3_ifx/shared/contracts/trusted-components.schema.json",
      "candidateValidation": "json-schema"
    },
    {
      "id": "policy-config-registry",
      "role": "trust-meta-policy",
      "paths": [
        "docs/guards/V3_ifx/shared/policy-config.json"
      ],
      "format": "json",
      "schema": "docs/guards/V3_ifx/shared/contracts/policy-config.schema.json",
      "candidateValidation": "json-schema"
    },
    {
      "id": "guard-system",
      "role": "trust-meta-policy",
      "paths": [
        "docs/guards/V3_ifx/guard-system.json"
      ],
      "format": "json",
      "schema": "docs/guards/V3_ifx/shared/contracts/guard-system.schema.json",
      "candidateValidation": "json-schema"
    },
    {
      "id": "ci-required-checks",
      "role": "trust-meta-policy",
      "paths": [
        "docs/guards/V3_ifx/stages/ci/required-checks.json"
      ],
      "format": "json",
      "schema": "docs/guards/V3_ifx/stages/ci/contracts/required-checks.schema.json",
      "candidateValidation": "json-schema"
    },
    {
      "id": "ci-activation",
      "role": "trust-meta-policy",
      "paths": [
        "docs/guards/V3_ifx/stages/ci/activation.json"
      ],
      "format": "json",
      "schema": "docs/guards/V3_ifx/stages/ci/contracts/activation.schema.json",
      "candidateValidation": "json-schema"
    },
    {
      "id": "ci-workflow-variables",
      "role": "trust-meta-policy",
      "paths": [
        "docs/guards/V3_ifx/stages/ci/workflow.variables.json"
      ],
      "format": "json",
      "schema": "docs/guards/V3_ifx/stages/ci/contracts/workflow-variables.schema.json",
      "candidateValidation": "json-schema"
    },
    {
      "id": "shared-contracts",
      "role": "trust-meta-policy",
      "directory": "docs/guards/V3_ifx/shared/contracts/",
      "format": "json",
      "candidateValidation": "json"
    },
    {
      "id": "diff-contracts",
      "role": "trust-meta-policy",
      "directory": "docs/guards/V3_ifx/stages/diff/contracts/",
      "format": "json",
      "candidateValidation": "json"
    },
    {
      "id": "ci-contracts",
      "role": "trust-meta-policy",
      "directory": "docs/guards/V3_ifx/stages/ci/contracts/",
      "format": "json",
      "candidateValidation": "json"
    },
    {
      "id": "specialized-contracts",
      "role": "trust-meta-policy",
      "directory": "docs/guards/V3_ifx/stages/post/gates/specialized/contracts/",
      "format": "json",
      "candidateValidation": "json"
    },
    {
      "id": "decision-history",
      "role": "trust-meta-policy",
      "paths": [
        "docs/guards/V3_ifx/shared/decisions/history/20260915-v3-ifx-ci-cutover.json",
        "docs/guards/V3_ifx/shared/decisions/history/20260916-ciq10-central-package-security.json",
        "docs/guards/V3_ifx/shared/decisions/history/20260916-v3-ifx-quality-cleanup.json",
        "docs/guards/V3_ifx/shared/decisions/history/20260916-v3-stage-d01-v3-ifx-distribution-boundary.json",
        "docs/guards/V3_ifx/shared/decisions/history/20260916-v3-stage-d02-v3-backup-retirement.json",
        "docs/guards/V3_ifx/shared/decisions/history/20260916-v3-stage-d03-untracked-stage-gate-source.json",
        "docs/guards/V3_ifx/shared/decisions/history/20260916-v3-stage-d04-read-only-generated-markdown.json",
        "docs/guards/V3_ifx/shared/decisions/history/20260916-v3-stage-d05-activation-install-modes.json",
        "docs/guards/V3_ifx/shared/decisions/history/20260916-v3-stage-d06-stable-naming.json",
        "docs/guards/V3_ifx/shared/decisions/history/20260916-v3-stage-d07-migration-unit-and-order.json",
        "docs/guards/V3_ifx/shared/decisions/history/20260916-v3-stage-d08-historical-integrity-stage.json",
        "docs/guards/V3_ifx/shared/decisions/history/20260916-v3-stage-d09-trusted-base-guard-execution.json",
        "docs/guards/V3_ifx/shared/decisions/history/20260916-v3-stage-d10-protected-change-authorization.json",
        "docs/guards/V3_ifx/shared/decisions/history/20260916-v3-stage-d11-lightweight-workflow-template.json",
        "docs/guards/V3_ifx/shared/decisions/history/20260916-v3-stage-d12-architecture-conformance-ownership.json",
        "docs/guards/V3_ifx/shared/decisions/history/20260916-v3-stage-d13-policy-config-monotonicity.json",
        "docs/guards/V3_ifx/shared/decisions/history/20260916-v3-stage-d14-package-local-build-baseline.json",
        "docs/guards/V3_ifx/shared/decisions/history/20260916-v3-stage-d15-trusted-base-component-upgrade.json",
        "docs/guards/V3_ifx/shared/decisions/history/20260916-v3-stage-d16-comparator-order-by-commit-frequency.json",
        "docs/guards/V3_ifx/shared/decisions/history/20260916-v3-stage-d17-plan04-phase-validator-retirement.json",
        "docs/guards/V3_ifx/shared/decisions/history/20260917-v3-stage-d18-domain-authority-hybrid-trust.json",